{
  "schema": "haven.purpose-authorization-context.v1",
  "contextId": "context-example-share-selected-update-001",
  "intentRef": "intent://example/share-selected-update-001",
  "authorizationStatus": "eligible",
  "identity": {
    "identityRef": "identity://example/owner-001",
    "domain": "example.local",
    "proofRef": "proof://example/owner-001-current"
  },
  "authority": {
    "authorityPath": "contract_grant",
    "agreementRef": "agreement://example/project-room-001",
    "contractRef": "contract://example/project-room-disclosure-001",
    "grantRef": "grant://example/project-room-disclosure-001",
    "ownerPath": { "present": false, "mayBypassExternalActionCeiling": false },
    "authorityCurrent": true
  },
  "trustPackageEvidence": {
    "evidenceRef": "trust-package://example/provider-and-recipient-audit-001",
    "status": "current",
    "confersAuthority": false
  },
  "checks": {
    "oneConcreteEffect": true,
    "exactPrimaryPurposeMatch": true,
    "parentMatchOnly": false,
    "facetMatchOnly": false,
    "unknownPurpose": false,
    "externalActionCeilingSatisfied": true,
    "destinationAllowed": true,
    "dataAllowed": true,
    "planAllowed": true,
    "storagePermissionSatisfied": true,
    "disclosureCapabilitySatisfied": true,
    "bindingDigestsMatch": true
  },
  "bindings": {
    "purposeDigest": "sha256:1111111111111111111111111111111111111111111111111111111111111111",
    "actionDigest": "sha256:2222222222222222222222222222222222222222222222222222222222222222",
    "destinationDigest": "sha256:3333333333333333333333333333333333333333333333333333333333333333",
    "dataManifestDigest": "sha256:4444444444444444444444444444444444444444444444444444444444444444",
    "planDigest": "sha256:5555555555555555555555555555555555555555555555555555555555555555",
    "configDigest": "sha256:6666666666666666666666666666666666666666666666666666666666666666",
    "policyDigest": "sha256:7777777777777777777777777777777777777777777777777777777777777777",
    "taxonomyDigest": "sha256:8888888888888888888888888888888888888888888888888888888888888888",
    "payloadDigest": "sha256:9999999999999999999999999999999999999999999999999999999999999999"
  }
}
